<?xml version="1.0" encoding="UTF-8"?>
<tns:nffgs 
	xmlns:tns="http://www.example.org/nffgInfo" 
	xmlns:xsi="http://www.w3.org/2001/XMLSchema-instance" 
	xsi:schemaLocation="http://www.example.org/nffgInfo nffgInfo.xsd ">


	<tns:nffg>
		<tns:name>nffg1</tns:name>
		<tns:lastUpdate>2015-07-21T21:00:00.000+02:00</tns:lastUpdate>

		<tns:node>
			<tns:name>nodo1</tns:name>
			<tns:functionality>FW</tns:functionality>
		</tns:node>

		<tns:node>
			<tns:name>nodo2</tns:name>
			<tns:functionality>NAT</tns:functionality>
		</tns:node>

		<tns:node>
			<tns:name>nodo3</tns:name>
			<tns:functionality>DPI</tns:functionality>
		</tns:node>

		<tns:node>
			<tns:name>nodo4</tns:name>
			<tns:functionality>DPI</tns:functionality>
		</tns:node>

		<tns:node>
			<tns:name>nodo5</tns:name>
			<tns:functionality>DPI</tns:functionality>
		</tns:node>

		<tns:link>
			<tns:name>link1</tns:name>
			<tns:src>nodo1</tns:src>
			<tns:dst>nodo4</tns:dst>
		</tns:link>

		<tns:link>
			<tns:name>link2</tns:name>
			<tns:src>nodo1</tns:src>
			<tns:dst>nodo2</tns:dst>
		</tns:link>

		<tns:policy>
			<tns:name>policy1</tns:name>
			<tns:positivity>true</tns:positivity>
			<tns:src>nodo4</tns:src>
			<tns:dst>nodo1</tns:dst>
			<tns:verification>
				<tns:verificationTime>2016-07-21T21:00:00.000+02:00</tns:verificationTime>
				<tns:result>true</tns:result>
				<tns:message>This policy is Verified</tns:message>
			</tns:verification>
		</tns:policy>
		
		<tns:policy>
			<tns:name>policy2</tns:name>
			<tns:positivity>true</tns:positivity>
			<tns:src>nodo1</tns:src>
			<tns:dst>nodo3</tns:dst>
			<tns:traversal>
				<tns:functionality>DPI</tns:functionality>
			</tns:traversal>
		</tns:policy>

	</tns:nffg>

	<tns:nffg>
		<tns:name>nffg2</tns:name>
		<tns:lastUpdate>2015-07-21T21:00:00.000+02:00</tns:lastUpdate>

		<tns:node>
			<tns:name>nodo1</tns:name>
			<tns:functionality>FW</tns:functionality>
		</tns:node>

		<tns:node>
			<tns:name>nodo2</tns:name>
			<tns:functionality>NAT</tns:functionality>
		</tns:node>

		<tns:node>
			<tns:name>nodo3</tns:name>
			<tns:functionality>DPI</tns:functionality>
		</tns:node>

		<tns:node>
			<tns:name>nodo4</tns:name>
			<tns:functionality>DPI</tns:functionality>
		</tns:node>

		<tns:node>
			<tns:name>nodo5</tns:name>
			<tns:functionality>DPI</tns:functionality>
		</tns:node>

		<tns:link>
			<tns:name>link1</tns:name>
			<tns:src>nodo1</tns:src>
			<tns:dst>nodo4</tns:dst>
		</tns:link>

		<tns:link>
			<tns:name>link2</tns:name>
			<tns:src>nodo1</tns:src>
			<tns:dst>nodo2</tns:dst>
		</tns:link>

		<tns:policy>
			<tns:name>policy3</tns:name>
			<tns:positivity>true</tns:positivity>
			<tns:src>nodo4</tns:src>
			<tns:dst>nodo1</tns:dst>
			<tns:verification>
				<tns:verificationTime>2016-07-21T21:00:00.000+02:00</tns:verificationTime>
				<tns:result>true</tns:result>
				<tns:message>This policy is Verified</tns:message>
			</tns:verification>
		</tns:policy>
		
		<tns:policy>
			<tns:name>policy4</tns:name>
			<tns:positivity>true</tns:positivity>
			<tns:src>nodo1</tns:src>
			<tns:dst>nodo3</tns:dst>
			<tns:traversal>
				<tns:functionality>DPI</tns:functionality>
			</tns:traversal>
		</tns:policy>

	</tns:nffg>
</tns:nffgs>